source,company,title,text,url,published_at,timestamp,mention_count,sentiment_score,sentiment_label,score,raw_json
twitter,CrowdStrike,CrowdStrike Falcon stopped a ransomware hit overnight,"Our team just witnessed Falcon detect and block ransomware before it spread. Incredible tech!",https://twitter.com/user/status/6011,2025-10-14T08:41:22Z,1728998482,83,0.81,positive,142,"{""domain"":""cybersecurity"",""processed_at"":""2025-10-14T22:18:45"",""source_type"":""twitter"",""engagement_metrics"":{""likes"":512,""shares"":189,""comments"":54}}"
reddit,Palo Alto Networks,Palo Alto Cortex XDR is seriously powerful,"Configured Cortex XDR in our SOC. Detects threats faster than expected.",https://reddit.com/r/cybersecurity/comments/6012,2025-10-14T09:13:55Z,1729000435,74,0.72,positive,118,"{""domain"":""cybersecurity"",""processed_at"":""2025-10-14T22:18:45"",""source_type"":""reddit"",""engagement_metrics"":{""likes"":247,""shares"":103,""comments"":44}}"
twitter,Fortinet,FortiGate firewall saved us from a major phishing campaign,"We blocked a big phishing run today thanks to Fortinet's AI filtering. Worth every penny.",https://twitter.com/user/status/6013,2025-10-13T19:22:48Z,1728936168,95,0.77,positive,129,"{""domain"":""cybersecurity"",""processed_at"":""2025-10-13T22:18:45"",""source_type"":""twitter"",""engagement_metrics"":{""likes"":432,""shares"":165,""comments"":39}}"
reddit,Cloudflare,Cloudflare mitigated another big DDoS wave,"We saw Cloudflare neutralize a 2Tbps attack without downtime. Crazy resilience!",https://reddit.com/r/netsec/comments/6014,2025-10-13T10:47:33Z,1728905253,119,0.86,positive,177,"{""domain"":""cybersecurity"",""processed_at"":""2025-10-13T22:18:45"",""source_type"":""reddit"",""engagement_metrics"":{""likes"":585,""shares"":243,""comments"":71}}"
twitter,Check Point,Check Point Quantum firewall impressed us this week,"Performance metrics exceeded expectations under heavy load. Smooth as ever.",https://twitter.com/user/status/6015,2025-10-12T08:39:12Z,1728815952,68,0.73,positive,103,"{""domain"":""cybersecurity"",""processed_at"":""2025-10-12T22:18:45"",""source_type"":""twitter"",""engagement_metrics"":{""likes"":308,""shares"":112,""comments"":27}}"
reddit,CrowdStrike,CrowdStrike OverWatch team caught an APT group,"OverWatch identified and stopped an APT campaign targeting our infrastructure. Amazing threat hunting!",https://reddit.com/r/cybersecurity/comments/6016,2025-10-12T14:25:17Z,1728836717,156,0.84,positive,189,"{""domain"":""cybersecurity"",""processed_at"":""2025-10-12T22:18:45"",""source_type"":""reddit"",""engagement_metrics"":{""likes"":678,""shares"":234,""comments"":89}}"
twitter,Palo Alto Networks,Palo Alto's Prisma Cloud saved us from a breach,"Prisma Cloud detected misconfigured S3 buckets before they were exploited. Crisis averted!",https://twitter.com/user/status/6017,2025-10-11T16:33:44Z,1728751424,92,0.79,positive,134,"{""domain"":""cybersecurity"",""processed_at"":""2025-10-11T22:18:45"",""source_type"":""twitter"",""engagement_metrics"":{""likes"":445,""shares"":167,""comments"":52}}"
reddit,Fortinet,Fortinet SD-WAN security is next level,"Deployed Fortinet's SD-WAN solution. The integrated security features are impressive.",https://reddit.com/r/networking/comments/6018,2025-10-11T11:18:29Z,1728732509,87,0.68,positive,121,"{""domain"":""cybersecurity"",""processed_at"":""2025-10-11T22:18:45"",""source_type"":""reddit"",""engagement_metrics"":{""likes"":334,""shares"":123,""comments"":67}}"
twitter,Cloudflare,Cloudflare Zero Trust made remote work secure,"Finally ditched our VPN for Cloudflare Zero Trust. Much better user experience and security.",https://twitter.com/user/status/6019,2025-10-10T13:47:22Z,1728655642,104,0.75,positive,156,"{""domain"":""cybersecurity"",""processed_at"":""2025-10-10T22:18:45"",""source_type"":""twitter"",""engagement_metrics"":{""likes"":523,""shares"":198,""comments"":73}}"
reddit,Check Point,Check Point Harmony Email stopped a CEO fraud,"Harmony Email caught a sophisticated CEO fraud attempt. Saved us from a $500K loss.",https://reddit.com/r/cybersecurity/comments/6020,2025-10-10T09:22:15Z,1728639735,134,0.82,positive,167,"{""domain"":""cybersecurity"",""processed_at"":""2025-10-10T22:18:45"",""source_type"":""reddit"",""engagement_metrics"":{""likes"":612,""shares"":223,""comments"":98}}"
twitter,CrowdStrike,CrowdStrike Falcon Go is perfect for SMBs,"Small business finally has enterprise-grade security with Falcon Go. Easy setup and great value.",https://twitter.com/user/status/6021,2025-10-09T15:11:38Z,1728576698,76,0.71,positive,112,"{""domain"":""cybersecurity"",""processed_at"":""2025-10-09T22:18:45"",""source_type"":""twitter"",""engagement_metrics"":{""likes"":389,""shares"":134,""comments"":45}}"
reddit,Palo Alto Networks,Palo Alto GlobalProtect VPN is solid,"Been using GlobalProtect for remote access. Reliable performance and good security features.",https://reddit.com/r/sysadmin/comments/6022,2025-10-09T12:44:52Z,1728567892,89,0.58,positive,98,"{""domain"":""cybersecurity"",""processed_at"":""2025-10-09T22:18:45"",""source_type"":""reddit"",""engagement_metrics"":{""likes"":267,""shares"":89,""comments"":56}}"
twitter,Fortinet,Fortinet FortiAnalyzer gives amazing visibility,"FortiAnalyzer's reporting capabilities are incredible. Finally understand our security posture.",https://twitter.com/user/status/6023,2025-10-08T17:29:15Z,1728495755,91,0.74,positive,127,"{""domain"":""cybersecurity"",""processed_at"":""2025-10-08T22:18:45"",""source_type"":""twitter"",""engagement_metrics"":{""likes"":456,""shares"":156,""comments"":62}}"
reddit,Cloudflare,Cloudflare Magic Transit is a game changer,"Magic Transit's always-on DDoS protection has been flawless. No more attack-related downtime.",https://reddit.com/r/networking/comments/6024,2025-10-08T10:55:33Z,1728472533,123,0.83,positive,145,"{""domain"":""cybersecurity"",""processed_at"":""2025-10-08T22:18:45"",""source_type"":""reddit"",""engagement_metrics"":{""likes"":567,""shares"":201,""comments"":78}}"
twitter,Check Point,Check Point Infinity architecture scales beautifully,"Infinity platform handles our multi-cloud security needs perfectly. Unified management is key.",https://twitter.com/user/status/6025,2025-10-07T14:18:47Z,1728404327,85,0.76,positive,119,"{""domain"":""cybersecurity"",""processed_at"":""2025-10-07T22:18:45"",""source_type"":""twitter"",""engagement_metrics"":{""likes"":378,""shares"":142,""comments"":51}}"
reddit,CrowdStrike,CrowdStrike Falcon Insight XDR deep dive,"Detailed analysis of Falcon Insight's capabilities. The threat hunting features are impressive.",https://reddit.com/r/cybersecurity/comments/6026,2025-10-07T11:33:22Z,1728394402,167,0.69,positive,134,"{""domain"":""cybersecurity"",""processed_at"":""2025-10-07T22:18:45"",""source_type"":""reddit"",""engagement_metrics"":{""likes"":445,""shares"":178,""comments"":89}}"
twitter,Palo Alto Networks,Palo Alto's Unit 42 threat intel is top tier,"Unit 42 reports are essential reading for any security team. Incredible threat intelligence.",https://twitter.com/user/status/6027,2025-10-06T16:42:11Z,1728325331,94,0.81,positive,156,"{""domain"":""cybersecurity"",""processed_at"":""2025-10-06T22:18:45"",""source_type"":""twitter"",""engagement_metrics"":{""likes"":523,""shares"":189,""comments"":67}}"
reddit,Fortinet,Fortinet FortiClient EMS management review,"Managing FortiClient endpoints across our org. Centralized control is good but UI needs work.",https://reddit.com/r/sysadmin/comments/6028,2025-10-06T13:27:44Z,1728313664,78,0.42,neutral,87,"{""domain"":""cybersecurity"",""processed_at"":""2025-10-06T22:18:45"",""source_type"":""reddit"",""engagement_metrics"":{""likes"":234,""shares"":89,""comments"":54}}"
twitter,Cloudflare,Cloudflare Access revolutionized our remote work,"Zero Trust Network Access made simple. No more VPN headaches for our distributed team!",https://twitter.com/user/status/6029,2025-10-05T12:15:33Z,1728222933,112,0.85,positive,167,"{""domain"":""cybersecurity"",""processed_at"":""2025-10-05T22:18:45"",""source_type"":""twitter"",""engagement_metrics"":{""likes"":612,""shares"":234,""comments"":78}}"
reddit,Check Point,Check Point vs Fortinet firewall comparison,"Comprehensive comparison between Check Point and Fortinet. Both solid but different strengths.",https://reddit.com/r/cybersecurity/comments/6030,2025-10-04T15:48:17Z,1728149297,145,0.35,neutral,98,"{""domain"":""cybersecurity"",""processed_at"":""2025-10-04T22:18:45"",""source_type"":""reddit"",""engagement_metrics"":{""likes"":356,""shares"":134,""comments"":89}}"
twitter,CrowdStrike,CrowdStrike's threat hunting is legendary,"The proactive threat hunting from CrowdStrike finds threats that automated tools miss. Unmatched expertise.",https://twitter.com/user/status/6031,2025-10-03T18:22:55Z,1728068575,128,0.88,positive,178,"{""domain"":""cybersecurity"",""processed_at"":""2025-10-03T22:18:45"",""source_type"":""twitter"",""engagement_metrics"":{""likes"":734,""shares"":267,""comments"":98}}"
reddit,Palo Alto Networks,Palo Alto WildFire sandbox analysis,"WildFire's malware analysis is incredibly detailed. Great threat intelligence for unknown files.",https://reddit.com/r/cybersecurity/comments/6032,2025-10-02T14:37:42Z,1727967462,156,0.73,positive,134,"{""domain"":""cybersecurity"",""processed_at"":""2025-10-02T22:18:45"",""source_type"":""reddit"",""engagement_metrics"":{""likes"":445,""shares"":167,""comments"":76}}"
twitter,Fortinet,Fortinet Security Fabric integration is seamless,"All Fortinet products work together perfectly in the Security Fabric. True unified security.",https://twitter.com/user/status/6033,2025-10-01T11:29:18Z,1727863758,89,0.78,positive,145,"{""domain"":""cybersecurity"",""processed_at"":""2025-10-01T22:18:45"",""source_type"":""twitter"",""engagement_metrics"":{""likes"":467,""shares"":178,""comments"":62}}"
reddit,Cloudflare,Cloudflare for Teams deployment guide,"Step-by-step Cloudflare for Teams setup. Zero Trust security model is definitely the future.",https://reddit.com/r/sysadmin/comments/6034,2025-09-30T16:44:33Z,1727806473,134,0.67,positive,123,"{""domain"":""cybersecurity"",""processed_at"":""2025-09-30T22:18:45"",""source_type"":""reddit"",""engagement_metrics"":{""likes"":389,""shares"":145,""comments"":67}}"
twitter,Check Point,Check Point Quantum firewalls are blazing fast,"The performance of Quantum firewalls is incredible. High throughput without compromising security.",https://twitter.com/user/status/6035,2025-09-29T13:17:25Z,1727707045,97,0.79,positive,156,"{""domain"":""cybersecurity"",""processed_at"":""2025-09-29T22:18:45"",""source_type"":""twitter"",""engagement_metrics"":{""likes"":523,""shares"":189,""comments"":73}}"
twitter,Palo Alto Networks,Cortex now integrates with SIEMs better,"Finally seeing native integration with Splunk and Sentinel. Smooth rollout.",https://twitter.com/user/status/6037,2025-10-04T17:56:44Z,1759549004,92,0.68,positive,122,"{""domain"":""cybersecurity"",""processed_at"":""2025-10-14T22:21:45"",""source_type"":""twitter"",""engagement_metrics"":{""likes"":359,""shares"":127,""comments"":37}}"
reddit,Fortinet,We switched to Fortinet SASE this quarter,"Network visibility improved a lot. Reporting tools need work though.",https://reddit.com/r/cyber/comments/6038,2025-10-05T08:28:10Z,1759624090,87,0.21,neutral,91,"{""domain"":""cybersecurity"",""processed_at"":""2025-10-14T22:21:45"",""source_type"":""reddit"",""engagement_metrics"":{""likes"":234,""shares"":91,""comments"":34}}"
twitter,Cloudflare,Cloudflare Radar showing global attack uptick,"+14% HTTP flood attempts this week alone. Trends are alarming.",https://twitter.com/user/status/6039,2025-10-05T15:39:21Z,1759652361,99,-0.41,negative,82,"{""domain"":""cybersecurity"",""processed_at"":""2025-10-14T22:21:45"",""source_type"":""twitter"",""engagement_metrics"":{""likes"":241,""shares"":94,""comments"":40}}"
reddit,Check Point,Quantum SD-WAN pilot test results,"Latency improved 20%, and no packet drops so far. Good stuff.",https://reddit.com/r/networking/comments/6040,2025-10-06T11:17:09Z,1759727829,93,0.73,positive,128,"{""domain"":""cybersecurity"",""processed_at"":""2025-10-14T22:21:45"",""source_type"":""reddit"",""engagement_metrics"":{""likes"":323,""shares"":113,""comments"":41}}"
twitter,CrowdStrike,Falcon’s data lake expansion makes sense,"Finally lets you query events directly without exporting. Saves tons of time.",https://twitter.com/user/status/6041,2025-10-06T20:08:11Z,1759762091,111,0.69,positive,126,"{""domain"":""cybersecurity"",""processed_at"":""2025-10-14T22:21:45"",""source_type"":""twitter"",""engagement_metrics"":{""likes"":372,""shares"":131,""comments"":44}}"
reddit,Palo Alto Networks,Palo Alto AI Ops dashboard demo,"Real-time config drift alerts were slick. Nice UX polish.",https://reddit.com/r/devsecops/comments/6042,2025-10-07T09:59:03Z,1759827543,84,0.66,positive,113,"{""domain"":""cybersecurity"",""processed_at"":""2025-10-14T22:21:45"",""source_type"":""reddit"",""engagement_metrics"":{""likes"":294,""shares"":108,""comments"":36}}"
twitter,Fortinet,Fortinet just added LLM-assisted config suggestions,"Honestly didn’t expect this to work so well. Saves hours in firewall tuning.",https://twitter.com/user/status/6043,2025-10-07T15:41:59Z,1759848119,102,0.75,positive,134,"{""domain"":""cybersecurity"",""processed_at"":""2025-10-14T22:21:45"",""source_type"":""twitter"",""engagement_metrics"":{""likes"":403,""shares"":143,""comments"":42}}"
reddit,Cloudflare,Cloudflare SSL outage analysis thread,"Turns out it was a cert chain issue, not DDoS. Quick transparency post from their team.",https://reddit.com/r/sysadmin/comments/6044,2025-10-08T08:19:44Z,1759911584,97,0.15,neutral,87,"{""domain"":""cybersecurity"",""processed_at"":""2025-10-14T22:21:45"",""source_type"":""reddit"",""engagement_metrics"":{""likes"":246,""shares"":93,""comments"":38}}"
twitter,Check Point,Quantum security updates just dropped,"Patch 1.3.5 improves memory efficiency and adds threat indicators.",https://twitter.com/user/status/6045,2025-10-08T13:24:33Z,1759933473,90,0.54,positive,107,"{""domain"":""cybersecurity"",""processed_at"":""2025-10-14T22:21:45"",""source_type"":""twitter"",""engagement_metrics"":{""likes"":311,""shares"":116,""comments"":32}}"
reddit,CrowdStrike,Is anyone testing Falcon OverWatch API yet?,"Early access users reporting faster correlation with SIEM events.",https://reddit.com/r/netsec/comments/6046,2025-10-09T10:08:25Z,1760004505,88,0.48,positive,99,"{""domain"":""cybersecurity"",""processed_at"":""2025-10-14T22:21:45"",""source_type"":""reddit"",""engagement_metrics"":{""likes"":278,""shares"":102,""comments"":33}}"
twitter,Palo Alto Networks,Incident response automation demoed at Ignite,"The speed of remediation is wild. Feels like SOAR on steroids.",https://twitter.com/user/status/6047,2025-10-09T18:41:52Z,1760035312,109,0.77,positive,139,"{""domain"":""cybersecurity"",""processed_at"":""2025-10-14T22:21:45"",""source_type"":""twitter"",""engagement_metrics"":{""likes"":429,""shares"":153,""comments"":47}}"
reddit,Fortinet,Fortinet WAF performance tweaks,"Less latency under load tests — noticeable bump from 7.2.7.",https://reddit.com/r/networking/comments/6048,2025-10-10T09:55:39Z,1760096139,91,0.62,positive,112,"{""domain"":""cybersecurity"",""processed_at"":""2025-10-14T22:21:45"",""source_type"":""reddit"",""engagement_metrics"":{""likes"":302,""shares"":109,""comments"":35}}"
twitter,Cloudflare,Cloudflare ML threat scoring now open-sourced,"Transparency move appreciated. Great documentation too.",https://twitter.com/user/status/6049,2025-10-10T15:49:33Z,1760120973,115,0.81,positive,133,"{""domain"":""cybersecurity"",""processed_at"":""2025-10-14T22:21:45"",""source_type"":""twitter"",""engagement_metrics"":{""likes"":441,""shares"":159,""comments"":48}}"
reddit,Check Point,Check Point’s new SOC visualization module,"Real-time event grouping looks like magic. Very analyst-friendly.",https://reddit.com/r/it/comments/6050,2025-10-11T08:14:19Z,1760184859,93,0.75,positive,125,"{""domain"":""cybersecurity"",""processed_at"":""2025-10-14T22:21:45"",""source_type"":""reddit"",""engagement_metrics"":{""likes"":317,""shares"":118,""comments"":39}}"
twitter,CrowdStrike,Real-world case: Falcon prevented insider data theft,"Endpoint DLP worked perfectly — prevented exfil via cloud drives.",https://twitter.com/user/status/6051,2025-10-11T19:47:52Z,1760221672,112,0.74,positive,131,"{""domain"":""cybersecurity"",""processed_at"":""2025-10-14T22:21:45"",""source_type"":""twitter"",""engagement_metrics"":{""likes"":392,""shares"":142,""comments"":43}}"
reddit,Palo Alto Networks,Cortex AI now detects lateral movement,"Saw it catch simulated APT pivot attempts in lab testing. Legit results.",https://reddit.com/r/cybersecurity/comments/6052,2025-10-12T08:32:05Z,1760286725,96,0.79,positive,127,"{""domain"":""cybersecurity"",""processed_at"":""2025-10-14T22:21:45"",""source_type"":""reddit"",""engagement_metrics"":{""likes"":331,""shares"":121,""comments"":41}}"
twitter,Fortinet,Fortinet’s new threat feed API is solid,"Finally integrates seamlessly with Splunk and Elastic. Big W.",https://twitter.com/user/status/6053,2025-10-12T15:26:40Z,1760314000,107,0.7,positive,126,"{""domain"":""cybersecurity"",""processed_at"":""2025-10-14T22:21:45"",""source_type"":""twitter"",""engagement_metrics"":{""likes"":384,""shares"":139,""comments"":42}}"
reddit,Cloudflare,Cloudflare email security beta,"Using AI to block lookalike domains and spear phishing. Promising early results.",https://reddit.com/r/sysadmin/comments/6054,2025-10-13T09:48:10Z,1760383690,89,0.67,positive,114,"{""domain"":""cybersecurity"",""processed_at"":""2025-10-14T22:21:45"",""source_type"":""reddit"",""engagement_metrics"":{""likes"":298,""shares"":108,""comments"":37}}"
twitter,Check Point,ThreatCloud X update — more real-time indicators,"Now detects emerging malware within 10 minutes of first sighting. Impressive.",https://twitter.com/user/status/6055,2025-10-13T16:54:55Z,1760412895,108,0.78,positive,132,"{""domain"":""cybersecurity"",""processed_at"":""2025-10-14T22:21:45"",""source_type"":""twitter"",""engagement_metrics"":{""likes"":402,""shares"":144,""comments"":43}}"
reddit,CrowdStrike,Falcon telemetry expansion coming soon,"More granular behavioral data means better detection across OS types.",https://reddit.com/r/itpros/comments/6056,2025-10-14T07:09:19Z,1760473759,101,0.71,positive,120,"{""domain"":""cybersecurity"",""processed_at"":""2025-10-14T22:21:45"",""source_type"":""reddit"",""engagement_metrics"":{""likes"":309,""shares"":116,""comments"":38}}"
twitter,Palo Alto Networks,Palo Alto announces SecureEdge update,"Zero trust at the edge just got simpler. Managed rollout next week.",https://twitter.com/user/status/6057,2025-10-14T13:11:31Z,1760497891,119,0.75,positive,136,"{""domain"":""cybersecurity"",""processed_at"":""2025-10-14T22:21:45"",""source_type"":""twitter"",""engagement_metrics"":{""likes"":437,""shares"":157,""comments"":45}}"
reddit,Fortinet,Fortinet training lab for blue teams,"Love the new simulated attack modules — perfect for junior analysts.",https://reddit.com/r/cybertraining/comments/6058,2025-10-14T19:24:09Z,1760521449,86,0.72,positive,115,"{""domain"":""cybersecurity"",""processed_at"":""2025-10-14T22:21:45"",""source_type"":""reddit"",""engagement_metrics"":{""likes"":292,""shares"":109,""comments"":36}}"
twitter,Cloudflare,Cloudflare adds AI-driven zero-day correlation,"Using LLMs to summarize threat clusters. Impressive efficiency gains.",https://twitter.com/user/status/6059,2025-10-14T22:10:37Z,1760531437,124,0.8,positive,139,"{""domain"":""cybersecurity"",""processed_at"":""2025-10-14T22:21:45"",""source_type"":""twitter"",""engagement_metrics"":{""likes"":451,""shares"":163,""comments"":46}}"
