source,company,title,text,url,published_at,timestamp,mention_count,sentiment_score,sentiment_label,score,raw_json
reddit,Intel,Just tried Intel's new Moore's law feature - game changer! 🚀,Just tried Intel's new Moore's law feature - game changer! 🚀,https://reddit.com/r/Moore'slaw/comments/316688,2025-07-12T16:35:03.483116Z,1752318303,132,0.26,positive,96,"{""domain"": ""semiconductors"", ""processed_at"": ""2025-10-06T21:11:03.483116"", ""source_type"": ""reddit"", ""engagement_metrics"": {""likes"": 58, ""shares"": 42, ""comments"": 21}}"
reddit,Intel,Unpopular opinion: Intel is overhyped in processors,Unpopular opinion: Intel is overhyped in processors,https://reddit.com/r/processors/comments/689591,2025-08-24T04:00:03.483116Z,1755988203,61,-0.623,negative,198,"{""domain"": ""semiconductors"", ""processed_at"": ""2025-10-06T21:11:03.483116"", ""source_type"": ""reddit"", ""engagement_metrics"": {""likes"": 841, ""shares"": 347, ""comments"": 41}}"
reddit,Intel,Deep dive into Intel's quantum computing technology stack,Deep dive into Intel's quantum computing technology stack,https://reddit.com/r/quantumcomputing/comments/793393,2025-09-25T02:11:03.483116Z,1758746463,121,0.8,positive,81,"{""domain"": ""semiconductors"", ""processed_at"": ""2025-10-06T21:11:03.483116"", ""source_type"": ""reddit"", ""engagement_metrics"": {""likes"": 958, ""shares"": 356, ""comments"": 200}}"
reddit,Intel,Intel hiring spree in chips - bullish signal?,Intel hiring spree in chips - bullish signal?,https://reddit.com/r/chips/comments/951504,2025-08-22T18:41:03.483116Z,1755868263,130,0.342,positive,33,"{""domain"": ""semiconductors"", ""processed_at"": ""2025-10-06T21:11:03.483116"", ""source_type"": ""reddit"", ""engagement_metrics"": {""likes"": 508, ""shares"": 191, ""comments"": 31}}"
reddit,TSMC,TSMC's semiconductors demo was impressive at the conference,TSMC's semiconductors demo was impressive at the conference,https://reddit.com/r/semiconductors/comments/289755,2025-09-10T02:09:03.483116Z,1757450343,137,0.367,positive,398,"{""domain"": ""semiconductors"", ""processed_at"": ""2025-10-06T21:11:03.484115"", ""source_type"": ""reddit"", ""engagement_metrics"": {""likes"": 258, ""shares"": 365, ""comments"": 61}}"
reddit,TSMC,Comparing fabrication solutions: TSMC vs competitors. Thread 🧵,Comparing fabrication solutions: TSMC vs competitors. Thread 🧵,https://reddit.com/r/fabrication/comments/729387,2025-08-14T06:34:03.483116Z,1755133443,43,0.3,positive,137,"{""domain"": ""semiconductors"", ""processed_at"": ""2025-10-06T21:11:03.484115"", ""source_type"": ""reddit"", ""engagement_metrics"": {""likes"": 529, ""shares"": 305, ""comments"": 145}}"
twitter,Qualcomm,Technical analysis of Qualcomm's GPU implementation,Technical analysis of Qualcomm's GPU implementation,https://twitter.com/user/status/2009794649768210111,2025-07-30T12:32:03.483116Z,1753858923,49,-0.033,neutral,78,"{""domain"": ""semiconductors"", ""processed_at"": ""2025-10-06T21:11:03.484115"", ""source_type"": ""twitter"", ""engagement_metrics"": {""likes"": 801, ""shares"": 294, ""comments"": 192}}"
reddit,Intel,Intel is leading the fabrication revolution. Exciting times ahead!,Intel is leading the fabrication revolution. Exciting times ahead!,https://reddit.com/r/fabrication/comments/553627,2025-07-29T09:17:03.483116Z,1753760823,141,0.052,neutral,138,"{""domain"": ""semiconductors"", ""processed_at"": ""2025-10-06T21:11:03.484115"", ""source_type"": ""reddit"", ""engagement_metrics"": {""likes"": 254, ""shares"": 54, ""comments"": 56}}"
twitter,Intel,Intel is leading the chips revolution. Exciting times ahead!,Intel is leading the chips revolution. Exciting times ahead!,https://twitter.com/user/status/7577021354180184395,2025-08-29T16:47:03.483116Z,1756466223,56,0.362,positive,61,"{""domain"": ""semiconductors"", ""processed_at"": ""2025-10-06T21:11:03.484115"", ""source_type"": ""twitter"", ""engagement_metrics"": {""likes"": 850, ""shares"": 193, ""comments"": 12}}"
reddit,Qualcomm,Breaking: Qualcomm announces major CPU update,Breaking: Qualcomm announces major CPU update,https://reddit.com/r/CPU/comments/361856,2025-09-10T20:43:03.483116Z,1757517183,88,-0.009,neutral,109,"{""domain"": ""semiconductors"", ""processed_at"": ""2025-10-06T21:11:03.484115"", ""source_type"": ""reddit"", ""engagement_metrics"": {""likes"": 214, ""shares"": 376, ""comments"": 143}}"
reddit,NVIDIA,Investment thesis: Why NVIDIA will dominate GPU,Investment thesis: Why NVIDIA will dominate GPU,https://reddit.com/r/GPU/comments/660949,2025-08-07T09:05:03.483116Z,1754537703,97,0.583,positive,84,"{""domain"": ""semiconductors"", ""processed_at"": ""2025-10-06T21:11:03.484115"", ""source_type"": ""reddit"", ""engagement_metrics"": {""likes"": 307, ""shares"": 478, ""comments"": 153}}"
reddit,Intel,Thoughts on Intel's approach to fabrication? Seems promising 🤔,Thoughts on Intel's approach to fabrication? Seems promising 🤔,https://reddit.com/r/fabrication/comments/588347,2025-07-23T22:13:03.483116Z,1753288983,90,0.24,neutral,38,"{""domain"": ""semiconductors"", ""processed_at"": ""2025-10-06T21:11:03.484115"", ""source_type"": ""reddit"", ""engagement_metrics"": {""likes"": 58, ""shares"": 236, ""comments"": 58}}"
twitter,Qualcomm,Deep dive into Qualcomm's processors technology stack,Deep dive into Qualcomm's processors technology stack,https://twitter.com/user/status/7106077014688362700,2025-10-05T06:58:03.483116Z,1759627683,122,-0.348,negative,205,"{""domain"": ""semiconductors"", ""processed_at"": ""2025-10-06T21:11:03.484115"", ""source_type"": ""twitter"", ""engagement_metrics"": {""likes"": 364, ""shares"": 309, ""comments"": 123}}"
twitter,NVIDIA,NVIDIA's semiconductors demo was impressive at the conference,NVIDIA's semiconductors demo was impressive at the conference,https://twitter.com/user/status/6729298485662532639,2025-07-27T01:34:03.483116Z,1753560243,14,-0.476,negative,37,"{""domain"": ""semiconductors"", ""processed_at"": ""2025-10-06T21:11:03.484115"", ""source_type"": ""twitter"", ""engagement_metrics"": {""likes"": 864, ""shares"": 228, ""comments"": 14}}"
reddit,AMD,Investment thesis: Why AMD will dominate GPU,Investment thesis: Why AMD will dominate GPU,https://reddit.com/r/GPU/comments/524203,2025-07-14T12:17:03.483116Z,1752475623,118,0.088,neutral,231,"{""domain"": ""semiconductors"", ""processed_at"": ""2025-10-06T21:11:03.484115"", ""source_type"": ""reddit"", ""engagement_metrics"": {""likes"": 522, ""shares"": 133, ""comments"": 151}}"
reddit,Qualcomm,Comparing Moore's law solutions: Qualcomm vs competitors. Thread 🧵,Comparing Moore's law solutions: Qualcomm vs competitors. Thread 🧵,https://reddit.com/r/Moore'slaw/comments/856108,2025-07-25T19:41:03.483116Z,1753452663,102,-0.061,neutral,102,"{""domain"": ""semiconductors"", ""processed_at"": ""2025-10-06T21:11:03.484115"", ""source_type"": ""reddit"", ""engagement_metrics"": {""likes"": 216, ""shares"": 199, ""comments"": 9}}"
reddit,NVIDIA,Why NVIDIA's nanotechnology strategy might be the future,Why NVIDIA's nanotechnology strategy might be the future,https://reddit.com/r/nanotechnology/comments/457318,2025-09-17T13:03:03.483116Z,1758094383,45,0.284,positive,51,"{""domain"": ""semiconductors"", ""processed_at"": ""2025-10-06T21:11:03.484115"", ""source_type"": ""reddit"", ""engagement_metrics"": {""likes"": 30, ""shares"": 58, ""comments"": 51}}"
twitter,NVIDIA,NVIDIA is leading the quantum computing revolution. Exciting times ahead!,NVIDIA is leading the quantum computing revolution. Exciting times ahead!,https://twitter.com/user/status/3132651971865829799,2025-08-15T12:49:03.483116Z,1755242343,82,0.166,neutral,25,"{""domain"": ""semiconductors"", ""processed_at"": ""2025-10-06T21:11:03.484115"", ""source_type"": ""twitter"", ""engagement_metrics"": {""likes"": 85, ""shares"": 24, ""comments"": 52}}"
reddit,Intel,Why Intel's nanotechnology strategy might be the future,Why Intel's nanotechnology strategy might be the future,https://reddit.com/r/nanotechnology/comments/369511,2025-09-19T06:50:03.483116Z,1758244803,36,-0.21,neutral,96,"{""domain"": ""semiconductors"", ""processed_at"": ""2025-10-06T21:11:03.485121"", ""source_type"": ""reddit"", ""engagement_metrics"": {""likes"": 357, ""shares"": 75, ""comments"": 20}}"
reddit,AMD,Unpopular opinion: AMD is overhyped in chips,Unpopular opinion: AMD is overhyped in chips,https://reddit.com/r/chips/comments/744930,2025-08-01T09:10:03.483116Z,1754019603,39,-0.197,neutral,130,"{""domain"": ""semiconductors"", ""processed_at"": ""2025-10-06T21:11:03.485121"", ""source_type"": ""reddit"", ""engagement_metrics"": {""likes"": 675, ""shares"": 249, ""comments"": 185}}"
twitter,Intel,Breaking: Intel announces major nanotechnology update,Breaking: Intel announces major nanotechnology update,https://twitter.com/user/status/8699793602297983585,2025-08-06T17:44:03.483116Z,1754482443,147,0.168,neutral,112,"{""domain"": ""semiconductors"", ""processed_at"": ""2025-10-06T21:11:03.485121"", ""source_type"": ""twitter"", ""engagement_metrics"": {""likes"": 699, ""shares"": 134, ""comments"": 168}}"
twitter,NVIDIA,Deep dive into NVIDIA's silicon technology stack,Deep dive into NVIDIA's silicon technology stack,https://twitter.com/user/status/9515250457049475735,2025-10-02T16:49:03.483116Z,1759403943,26,-0.208,neutral,290,"{""domain"": ""semiconductors"", ""processed_at"": ""2025-10-06T21:11:03.485121"", ""source_type"": ""twitter"", ""engagement_metrics"": {""likes"": 840, ""shares"": 384, ""comments"": 141}}"
reddit,NVIDIA,NVIDIA is leading the semiconductors revolution. Exciting times ahead!,NVIDIA is leading the semiconductors revolution. Exciting times ahead!,https://reddit.com/r/semiconductors/comments/329284,2025-07-11T20:45:03.483116Z,1752246903,103,0.005,neutral,91,"{""domain"": ""semiconductors"", ""processed_at"": ""2025-10-06T21:11:03.485121"", ""source_type"": ""reddit"", ""engagement_metrics"": {""likes"": 394, ""shares"": 319, ""comments"": 168}}"
twitter,Intel,Technical analysis of Intel's processors implementation,Technical analysis of Intel's processors implementation,https://twitter.com/user/status/9084166405277953196,2025-07-10T04:43:03.483116Z,1752102783,32,-0.237,neutral,418,"{""domain"": ""semiconductors"", ""processed_at"": ""2025-10-06T21:11:03.485121"", ""source_type"": ""twitter"", ""engagement_metrics"": {""likes"": 503, ""shares"": 226, ""comments"": 158}}"
reddit,NVIDIA,NVIDIA is leading the quantum computing revolution. Exciting times ahead!,NVIDIA is leading the quantum computing revolution. Exciting times ahead!,https://reddit.com/r/quantumcomputing/comments/103826,2025-08-16T16:35:03.483116Z,1755342303,42,-0.194,neutral,19,"{""domain"": ""semiconductors"", ""processed_at"": ""2025-10-06T21:11:03.485121"", ""source_type"": ""reddit"", ""engagement_metrics"": {""likes"": 111, ""shares"": 405, ""comments"": 127}}"
reddit,AMD,Technical analysis of AMD's semiconductors implementation,Technical analysis of AMD's semiconductors implementation,https://reddit.com/r/semiconductors/comments/253221,2025-09-19T02:10:03.483116Z,1758228003,82,0.201,neutral,111,"{""domain"": ""semiconductors"", ""processed_at"": ""2025-10-06T21:11:03.485121"", ""source_type"": ""reddit"", ""engagement_metrics"": {""likes"": 423, ""shares"": 25, ""comments"": 28}}"
reddit,Intel,Intel hiring spree in fabrication - bullish signal?,Intel hiring spree in fabrication - bullish signal?,https://reddit.com/r/fabrication/comments/742116,2025-07-10T21:11:03.483116Z,1752162063,39,-0.082,neutral,100,"{""domain"": ""semiconductors"", ""processed_at"": ""2025-10-06T21:11:03.485121"", ""source_type"": ""reddit"", ""engagement_metrics"": {""likes"": 311, ""shares"": 229, ""comments"": 115}}"
twitter,Qualcomm,Qualcomm hiring spree in Moore's law - bullish signal?,Qualcomm hiring spree in Moore's law - bullish signal?,https://twitter.com/user/status/8905005044317624333,2025-09-27T13:31:03.483116Z,1758960063,44,0.218,neutral,35,"{""domain"": ""semiconductors"", ""processed_at"": ""2025-10-06T21:11:03.485121"", ""source_type"": ""twitter"", ""engagement_metrics"": {""likes"": 950, ""shares"": 57, ""comments"": 162}}"
twitter,NVIDIA,NVIDIA's nanotechnology demo was impressive at the conference,NVIDIA's nanotechnology demo was impressive at the conference,https://twitter.com/user/status/7875339941074120611,2025-09-13T09:18:03.483116Z,1757735283,42,0.274,positive,204,"{""domain"": ""semiconductors"", ""processed_at"": ""2025-10-06T21:11:03.485121"", ""source_type"": ""twitter"", ""engagement_metrics"": {""likes"": 302, ""shares"": 154, ""comments"": 166}}"
twitter,TSMC,TSMC's semiconductors demo was impressive at the conference,TSMC's semiconductors demo was impressive at the conference,https://twitter.com/user/status/6835270216372850914,2025-09-13T04:08:03.483116Z,1757716683,94,0.013,neutral,83,"{""domain"": ""semiconductors"", ""processed_at"": ""2025-10-06T21:11:03.485121"", ""source_type"": ""twitter"", ""engagement_metrics"": {""likes"": 751, ""shares"": 159, ""comments"": 70}}"
reddit,Intel,Thoughts on Intel's approach to semiconductors? Seems promising 🤔,Thoughts on Intel's approach to semiconductors? Seems promising 🤔,https://reddit.com/r/semiconductors/comments/433836,2025-10-05T23:12:03.483116Z,1759686123,114,0.485,positive,169,"{""domain"": ""semiconductors"", ""processed_at"": ""2025-10-06T21:11:03.486120"", ""source_type"": ""reddit"", ""engagement_metrics"": {""likes"": 390, ""shares"": 458, ""comments"": 86}}"
reddit,TSMC,Just tried TSMC's new semiconductors feature - game changer! 🚀,Just tried TSMC's new semiconductors feature - game changer! 🚀,https://reddit.com/r/semiconductors/comments/869294,2025-09-01T04:39:03.483116Z,1756681743,33,-0.455,negative,131,"{""domain"": ""semiconductors"", ""processed_at"": ""2025-10-06T21:11:03.486120"", ""source_type"": ""reddit"", ""engagement_metrics"": {""likes"": 881, ""shares"": 234, ""comments"": 53}}"
twitter,AMD,Just tried AMD's new silicon feature - game changer! 🚀,Just tried AMD's new silicon feature - game changer! 🚀,https://twitter.com/user/status/1547236517498845018,2025-08-03T14:17:03.483116Z,1754210823,44,-0.278,negative,94,"{""domain"": ""semiconductors"", ""processed_at"": ""2025-10-06T21:11:03.486120"", ""source_type"": ""twitter"", ""engagement_metrics"": {""likes"": 169, ""shares"": 51, ""comments"": 121}}"
reddit,TSMC,Investment thesis: Why TSMC will dominate quantum computing,Investment thesis: Why TSMC will dominate quantum computing,https://reddit.com/r/quantumcomputing/comments/138118,2025-08-11T05:17:03.483116Z,1754869623,40,0.121,neutral,214,"{""domain"": ""semiconductors"", ""processed_at"": ""2025-10-06T21:11:03.486120"", ""source_type"": ""reddit"", ""engagement_metrics"": {""likes"": 235, ""shares"": 299, ""comments"": 39}}"
reddit,TSMC,Why TSMC's nanotechnology strategy might be the future,Why TSMC's nanotechnology strategy might be the future,https://reddit.com/r/nanotechnology/comments/651276,2025-07-22T08:03:03.483116Z,1753151583,110,0.124,neutral,212,"{""domain"": ""semiconductors"", ""processed_at"": ""2025-10-06T21:11:03.486120"", ""source_type"": ""reddit"", ""engagement_metrics"": {""likes"": 824, ""shares"": 386, ""comments"": 179}}"
twitter,Qualcomm,Qualcomm's nanotechnology demo was impressive at the conference,Qualcomm's nanotechnology demo was impressive at the conference,https://twitter.com/user/status/1334158660861857310,2025-09-01T15:27:03.483116Z,1756720623,142,0.389,positive,62,"{""domain"": ""semiconductors"", ""processed_at"": ""2025-10-06T21:11:03.486120"", ""source_type"": ""twitter"", ""engagement_metrics"": {""likes"": 531, ""shares"": 388, ""comments"": 188}}"
reddit,Qualcomm,User experience review: Qualcomm's nanotechnology platform,User experience review: Qualcomm's nanotechnology platform,https://reddit.com/r/nanotechnology/comments/451725,2025-08-02T14:57:03.483116Z,1754126823,12,-0.148,neutral,155,"{""domain"": ""semiconductors"", ""processed_at"": ""2025-10-06T21:11:03.486120"", ""source_type"": ""reddit"", ""engagement_metrics"": {""likes"": 820, ""shares"": 365, ""comments"": 81}}"
reddit,NVIDIA,NVIDIA's nanotechnology demo was impressive at the conference,NVIDIA's nanotechnology demo was impressive at the conference,https://reddit.com/r/nanotechnology/comments/254809,2025-08-22T15:22:03.483116Z,1755856323,27,-0.211,neutral,15,"{""domain"": ""semiconductors"", ""processed_at"": ""2025-10-06T21:11:03.486120"", ""source_type"": ""reddit"", ""engagement_metrics"": {""likes"": 514, ""shares"": 69, ""comments"": 4}}"
reddit,TSMC,TSMC is leading the semiconductors revolution. Exciting times ahead!,TSMC is leading the semiconductors revolution. Exciting times ahead!,https://reddit.com/r/semiconductors/comments/419139,2025-09-23T06:10:03.483116Z,1758588003,80,-0.252,negative,343,"{""domain"": ""semiconductors"", ""processed_at"": ""2025-10-06T21:11:03.486120"", ""source_type"": ""reddit"", ""engagement_metrics"": {""likes"": 877, ""shares"": 139, ""comments"": 157}}"
twitter,Qualcomm,Anyone else excited about Qualcomm's GPU roadmap?,Anyone else excited about Qualcomm's GPU roadmap?,https://twitter.com/user/status/1472906417422840838,2025-08-20T11:15:03.483116Z,1755668703,47,0.015,neutral,64,"{""domain"": ""semiconductors"", ""processed_at"": ""2025-10-06T21:11:03.486120"", ""source_type"": ""twitter"", ""engagement_metrics"": {""likes"": 303, ""shares"": 35, ""comments"": 141}}"
reddit,NVIDIA,Breaking: NVIDIA announces major fabrication update,Breaking: NVIDIA announces major fabrication update,https://reddit.com/r/fabrication/comments/449169,2025-08-03T20:05:03.483116Z,1754231703,73,-0.27,negative,21,"{""domain"": ""semiconductors"", ""processed_at"": ""2025-10-06T21:11:03.486120"", ""source_type"": ""reddit"", ""engagement_metrics"": {""likes"": 494, ""shares"": 463, ""comments"": 200}}"
twitter,AMD,Investment thesis: Why AMD will dominate nanotechnology,Investment thesis: Why AMD will dominate nanotechnology,https://twitter.com/user/status/4166688069346744523,2025-07-21T07:49:03.483116Z,1753064343,56,-0.26,negative,37,"{""domain"": ""semiconductors"", ""processed_at"": ""2025-10-06T21:11:03.486120"", ""source_type"": ""twitter"", ""engagement_metrics"": {""likes"": 155, ""shares"": 377, ""comments"": 92}}"
twitter,Qualcomm,Breaking: Qualcomm announces major quantum computing update,Breaking: Qualcomm announces major quantum computing update,https://twitter.com/user/status/3489328088894707338,2025-08-05T08:14:03.483116Z,1754361843,80,-0.01,neutral,59,"{""domain"": ""semiconductors"", ""processed_at"": ""2025-10-06T21:11:03.486120"", ""source_type"": ""twitter"", ""engagement_metrics"": {""likes"": 69, ""shares"": 305, ""comments"": 91}}"
twitter,Intel,Just tried Intel's new semiconductors feature - game changer! 🚀,Just tried Intel's new semiconductors feature - game changer! 🚀,https://twitter.com/user/status/4521645544824474324,2025-07-09T15:13:03.483116Z,1752054183,51,0.198,neutral,11,"{""domain"": ""semiconductors"", ""processed_at"": ""2025-10-06T21:11:03.486120"", ""source_type"": ""twitter"", ""engagement_metrics"": {""likes"": 200, ""shares"": 353, ""comments"": 130}}"
reddit,NVIDIA,Why NVIDIA's semiconductors strategy might be the future,Why NVIDIA's semiconductors strategy might be the future,https://reddit.com/r/semiconductors/comments/878589,2025-09-24T07:50:03.483116Z,1758680403,71,0.721,positive,22,"{""domain"": ""semiconductors"", ""processed_at"": ""2025-10-06T21:11:03.486120"", ""source_type"": ""reddit"", ""engagement_metrics"": {""likes"": 770, ""shares"": 339, ""comments"": 15}}"
twitter,TSMC,Unpopular opinion: TSMC is overhyped in Moore's law,Unpopular opinion: TSMC is overhyped in Moore's law,https://twitter.com/user/status/6556323125430704811,2025-07-21T04:09:03.483116Z,1753051143,118,-0.052,neutral,21,"{""domain"": ""semiconductors"", ""processed_at"": ""2025-10-06T21:11:03.486120"", ""source_type"": ""twitter"", ""engagement_metrics"": {""likes"": 821, ""shares"": 282, ""comments"": 138}}"
reddit,TSMC,Comparing quantum computing solutions: TSMC vs competitors. Thread 🧵,Comparing quantum computing solutions: TSMC vs competitors. Thread 🧵,https://reddit.com/r/quantumcomputing/comments/509323,2025-07-11T04:13:03.483116Z,1752187383,104,0.664,positive,26,"{""domain"": ""semiconductors"", ""processed_at"": ""2025-10-06T21:11:03.487116"", ""source_type"": ""reddit"", ""engagement_metrics"": {""likes"": 206, ""shares"": 257, ""comments"": 52}}"
twitter,AMD,Comparing quantum computing solutions: AMD vs competitors. Thread 🧵,Comparing quantum computing solutions: AMD vs competitors. Thread 🧵,https://twitter.com/user/status/1334820544829966966,2025-09-11T18:48:03.483116Z,1757596683,59,0.787,positive,79,"{""domain"": ""semiconductors"", ""processed_at"": ""2025-10-06T21:11:03.487116"", ""source_type"": ""twitter"", ""engagement_metrics"": {""likes"": 998, ""shares"": 380, ""comments"": 72}}"
twitter,AMD,Hot take: AMD is undervalued in the CPU space,Hot take: AMD is undervalued in the CPU space,https://twitter.com/user/status/1792800214135943714,2025-08-10T09:28:03.483116Z,1754798283,112,-0.095,neutral,102,"{""domain"": ""semiconductors"", ""processed_at"": ""2025-10-06T21:11:03.487116"", ""source_type"": ""twitter"", ""engagement_metrics"": {""likes"": 737, ""shares"": 433, ""comments"": 164}}"
twitter,AMD,Technical analysis of AMD's Moore's law implementation,Technical analysis of AMD's Moore's law implementation,https://twitter.com/user/status/4601461313295984706,2025-09-18T03:20:03.483116Z,1758145803,121,0.279,positive,219,"{""domain"": ""semiconductors"", ""processed_at"": ""2025-10-06T21:11:03.487116"", ""source_type"": ""twitter"", ""engagement_metrics"": {""likes"": 308, ""shares"": 232, ""comments"": 53}}"
